{
  "cert_id": "blake3:0000000000000000000000000000000000000000000000000000000000000000",
  "schema": "freshdag.certificate/v0.1",
  "artifact": {
    "id": "blake3:aaaaaaaaaaaaaaaaaaaaaaaaaaaaaaaaaaaaaaaaaaaaaaaaaaaaaaaaaaaaaaaa",
    "kind": "text/markdown",
    "content_hash": "blake3:aaaaaaaaaaaaaaaaaaaaaaaaaaaaaaaaaaaaaaaaaaaaaaaaaaaaaaaaaaaaaaaa",
    "size": 100
  },
  "produced_by": {
    "computation_id": "comp:aaaaaaaaaaaaaaaaaaaaaaaaaaaaaaaaaaaaaaaaaaaaaaaaaaaaaaaaaaaaaaaa",
    "recipe_hash": "blake3:bbbbbbbbbbbbbbbbbbbbbbbbbbbbbbbbbbbbbbbbbbbbbbbbbbbbbbbbbbbbbbbb",
    "adapter": "freshdag-adapter-claude/0.1.0",
    "started": "2026-08-15T13:45:12.001Z",
    "ended": "2026-08-15T13:46:07.892Z"
  },
  "depends_on": [
    {
      "key": "web.search://q=x",
      "scheme": "web.search",
      "trust_class": "volatile",
      "fingerprint": "custom:x",
      "observed_at": "2026-08-15T13:45:22.812Z"
    }
  ],
  "status": {
    "value": "likely-valid",
    "checked": "2026-08-15T13:46:08.001Z",
    "reasons": [
      {
        "dependency_key": "web.search://q=x",
        "reason": "trust-class-volatile-caps-at-likely-valid"
      }
    ]
  },
  "observation_coverage": [
    { "producer": "freshdag-adapter-claude", "version": "0.1.0", "role": "adapter" }
  ]
}
