{
  "cert_id": "blake3:0000000000000000000000000000000000000000000000000000000000000000",
  "schema": "freshdag.certificate/v0.1",
  "artifact": {
    "id": "blake3:aaaaaaaaaaaaaaaaaaaaaaaaaaaaaaaaaaaaaaaaaaaaaaaaaaaaaaaaaaaaaaaa",
    "path": "briefs/acme.md",
    "kind": "text/markdown",
    "content_hash": "blake3:aaaaaaaaaaaaaaaaaaaaaaaaaaaaaaaaaaaaaaaaaaaaaaaaaaaaaaaaaaaaaaaa",
    "size": 4213
  },
  "produced_by": {
    "computation_id": "comp:3333333333333333333333333333333333333333333333333333333333333333",
    "recipe": "research-account",
    "recipe_hash": "blake3:bbbbbbbbbbbbbbbbbbbbbbbbbbbbbbbbbbbbbbbbbbbbbbbbbbbbbbbbbbbbbbbb",
    "adapter": "freshdag-adapter-claude/0.1.0",
    "started": "2026-08-15T13:45:12.001Z",
    "ended": "2026-08-15T13:46:07.892Z"
  },
  "depends_on": [
    {
      "key": "https://acme.com/pricing",
      "scheme": "https",
      "trust_class": "heuristic",
      "fingerprint": "etag:W/\"weak-etag\"",
      "observed_at": "2026-08-15T13:45:18.541Z"
    }
  ],
  "comparator": {
    "name": "exact"
  },
  "status": {
    "value": "likely-valid",
    "checked": "2026-08-15T13:46:08.001Z",
    "reasons": [
      {
        "dependency_key": "https://acme.com/pricing",
        "reason": "trust-class-heuristic-caps-at-likely-valid"
      }
    ]
  },
  "observation_coverage": [
    {
      "producer": "freshdag-adapter-claude",
      "version": "0.1.0",
      "role": "adapter",
      "partial": {}
    }
  ]
}
