{
  "cert_id": "blake3:0000000000000000000000000000000000000000000000000000000000000000",
  "schema": "freshdag.certificate/v0.1",
  "artifact": {
    "id": "blake3:aaaaaaaaaaaaaaaaaaaaaaaaaaaaaaaaaaaaaaaaaaaaaaaaaaaaaaaaaaaaaaaa",
    "path": "briefs/acme.md",
    "kind": "text/markdown",
    "content_hash": "blake3:aaaaaaaaaaaaaaaaaaaaaaaaaaaaaaaaaaaaaaaaaaaaaaaaaaaaaaaaaaaaaaaa",
    "size": 4213
  },
  "produced_by": {
    "computation_id": "comp:1111111111111111111111111111111111111111111111111111111111111111",
    "recipe": "research-account",
    "recipe_hash": "blake3:bbbbbbbbbbbbbbbbbbbbbbbbbbbbbbbbbbbbbbbbbbbbbbbbbbbbbbbbbbbbbbbb",
    "adapter": "freshdag-adapter-claude/0.1.0",
    "started": "2026-08-15T13:45:12.001Z",
    "ended": "2026-08-15T13:46:07.892Z"
  },
  "depends_on": [
    {
      "key": "file:///abs/path/ICP.md",
      "scheme": "file",
      "trust_class": "exact",
      "fingerprint": "blake3:cccccccccccccccccccccccccccccccccccccccccccccccccccccccccccccccc",
      "observed_at": "2026-08-15T13:45:14.220Z"
    }
  ],
  "comparator": {
    "name": "exact"
  },
  "status": {
    "value": "valid",
    "checked": "2026-08-15T13:46:08.001Z"
  },
  "observation_coverage": [
    {
      "producer": "freshdag-adapter-claude",
      "version": "0.1.0",
      "role": "adapter",
      "partial": {}
    }
  ]
}
