{
  "cert_id": "blake3:0000000000000000000000000000000000000000000000000000000000000000",
  "schema": "freshdag.certificate/v0.1",
  "artifact": {
    "id": "blake3:aaaaaaaaaaaaaaaaaaaaaaaaaaaaaaaaaaaaaaaaaaaaaaaaaaaaaaaaaaaaaaaa",
    "kind": "text/markdown",
    "content_hash": "blake3:aaaaaaaaaaaaaaaaaaaaaaaaaaaaaaaaaaaaaaaaaaaaaaaaaaaaaaaaaaaaaaaa",
    "size": 100
  },
  "produced_by": {
    "computation_id": "comp:5555555555555555555555555555555555555555555555555555555555555555",
    "adapter": "freshdag-adapter-claude/0.1.0",
    "started": "2026-08-15T13:45:12.001Z",
    "ended": "2026-08-15T13:46:07.892Z"
  },
  "depends_on": [
    {
      "key": "https://acme.com/pricing",
      "scheme": "https",
      "trust_class": "versioned",
      "fingerprint": "etag:\"abc\"",
      "observed_at": "2026-08-15T13:45:14.220Z"
    }
  ],
  "status": {
    "value": "unknown",
    "checked": "2026-08-15T13:46:08.001Z",
    "reasons": [
      {
        "dependency_key": "https://acme.com/pricing",
        "reason": "probe-unknown"
      }
    ]
  },
  "observation_coverage": [
    { "producer": "freshdag-adapter-claude", "version": "0.1.0", "role": "adapter" }
  ]
}
